{
  "$schema": "https://json-schema.org/draft/2020-12/schema",
  "$id": "https://raw.githubusercontent.com/raghavkandpal/parison/main/src/parison/schemas/recipe-v1.schema.json",
  "title": "Parison recipe v1",
  "description": "A strict keyed comparison policy. Review scope, identity, types, mappings, tolerances and evidence sensitivity before use.",
  "type": "object",
  "additionalProperties": false,
  "required": ["recipe_version", "comparison_mode", "keys", "scope", "identity", "nulls_equal", "columns"],
  "properties": {
    "recipe_version": {"const": 1},
    "comparison_mode": {"const": "keyed"},
    "keys": {"description": "Canonical columns that uniquely identify one logical record.", "type": "array", "minItems": 1, "uniqueItems": true, "items": {"type": "string", "minLength": 1}},
    "scope": {
      "type": "object",
      "additionalProperties": false,
      "required": ["snapshot", "cutoff", "filters", "completeness", "expected_empty"],
      "properties": {
        "snapshot": {"type": "string", "minLength": 1},
        "cutoff": {"type": "string", "minLength": 1},
        "filters": {"type": "array", "items": {"type": "string", "minLength": 1}},
        "completeness": {"const": "full"},
        "expected_empty": {"type": "boolean"}
      }
    },
    "identity": {
      "type": "object",
      "additionalProperties": false,
      "required": ["null_keys", "duplicates"],
      "properties": {"null_keys": {"const": "reject"}, "duplicates": {"const": "reject"}}
    },
    "nulls_equal": {"type": "boolean"},
    "null_tokens": {
      "type": "object",
      "additionalProperties": false,
      "required": ["baseline", "candidate"],
      "properties": {
        "baseline": {"type": "array", "uniqueItems": true, "items": {"type": "string", "minLength": 1}},
        "candidate": {"type": "array", "uniqueItems": true, "items": {"type": "string", "minLength": 1}}
      }
    },
    "columns": {"description": "Canonical compared columns and their explicit data semantics.", "type": "object", "minProperties": 1, "additionalProperties": {"$ref": "#/$defs/column"}},
    "column_mappings": {
      "type": "object",
      "additionalProperties": {
        "type": "object",
        "additionalProperties": false,
        "required": ["baseline", "candidate"],
        "properties": {
          "baseline": {"type": "string", "minLength": 1},
          "candidate": {"type": "string", "minLength": 1}
        }
      }
    },
    "excluded_columns": {"type": "object", "additionalProperties": {"type": "string", "minLength": 1}},
    "delimiters": {
      "type": "object",
      "additionalProperties": false,
      "required": ["baseline", "candidate"],
      "properties": {
        "baseline": {"type": "string", "minLength": 1, "maxLength": 1},
        "candidate": {"type": "string", "minLength": 1, "maxLength": 1}
      }
    },
    "output": {
      "type": "object",
      "additionalProperties": false,
      "required": ["sensitivity"],
      "properties": {"sensitivity": {"enum": ["summary", "raw"]}}
    }
  },
  "$defs": {
    "column": {
      "type": "object",
      "additionalProperties": false,
      "required": ["type"],
      "properties": {
        "type": {"enum": ["string", "integer", "decimal", "float", "boolean", "date", "timestamp"]},
        "comparison": {"enum": ["exact", "numeric"]},
        "tolerance": {
          "type": "object",
          "additionalProperties": false,
          "required": ["formula", "absolute", "relative"],
          "properties": {
            "formula": {"const": "symmetric-v1"},
            "absolute": {"type": ["string", "number", "integer"]},
            "relative": {"type": ["string", "number", "integer"]}
          }
        },
        "timezone": {"const": "require-aware"},
        "scale": {"type": "integer", "minimum": 0},
        "normalize": {
          "type": "array",
          "uniqueItems": true,
          "items": {"enum": ["trim", "casefold", "unicode_nfc"]}
        }
      },
      "allOf": [
        {"if": {"properties": {"type": {"const": "timestamp"}}}, "then": {"required": ["timezone"]}, "else": {"not": {"required": ["timezone"]}}},
        {"if": {"properties": {"type": {"const": "decimal"}}}, "then": {"required": ["scale"]}, "else": {"not": {"required": ["scale"]}}},
        {
          "if": {"properties": {"comparison": {"const": "numeric"}}, "required": ["comparison"]},
          "then": {"required": ["tolerance"], "properties": {"type": {"enum": ["integer", "decimal", "float"]}}},
          "else": {"not": {"required": ["tolerance"]}}
        },
        {"if": {"properties": {"type": {"const": "string"}}}, "else": {"not": {"required": ["normalize"]}}}
      ]
    }
  }
}
