{"columns":{"amount":{"comparison":"exact","scale":2,"type":"decimal"},"id":{"comparison":"exact","type":"integer"},"tenant":{"comparison":"exact","normalize":["unicode_nfc","casefold"],"type":"string"}},"comparison_mode":"keyed","identity":{"duplicates":"reject","null_keys":"reject"},"keys":["tenant","id"],"null_tokens":{"baseline":["NULL"],"candidate":["MISSING"]},"nulls_equal":true,"output":{"sensitivity":"summary"},"recipe_version":1,"scope":{"completeness":"full","cutoff":"2026-10-29T00:00:00Z","expected_empty":false,"filters":[],"snapshot":"hash-wire-v1"}}
