{
  "recipe_version": 1,
  "comparison_mode": "keyed",
  "keys": ["entity_id"],
  "scope": {
    "snapshot": "synthetic-feature-span-2026-10-12",
    "cutoff": "2026-10-12T00:00:00Z",
    "filters": [],
    "completeness": "full",
    "expected_empty": false
  },
  "identity": {"null_keys": "reject", "duplicates": "reject"},
  "nulls_equal": true,
  "columns": {
    "entity_id": {"type": "string", "comparison": "exact"},
    "risk_score": {
      "type": "decimal",
      "scale": 4,
      "comparison": "numeric",
      "tolerance": {"formula": "symmetric-v1", "absolute": "0.0010", "relative": "0"}
    },
    "event_count": {"type": "integer", "comparison": "exact"},
    "segment": {"type": "string", "comparison": "exact"}
  },
  "output": {"sensitivity": "summary"}
}
