{
  "recipe_version": 1,
  "comparison_mode": "keyed",
  "keys": ["id"],
  "scope": {
    "snapshot": "fixture-investigation-v1",
    "cutoff": "2026-10-29T00:00:00Z",
    "filters": [],
    "completeness": "full",
    "expected_empty": false
  },
  "identity": {"null_keys": "reject", "duplicates": "reject"},
  "nulls_equal": true,
  "columns": {
    "id": {"type": "integer", "comparison": "exact"},
    "amount": {
      "type": "decimal",
      "scale": 2,
      "comparison": "numeric",
      "tolerance": {"formula": "symmetric-v1", "absolute": "1.00", "relative": "0"}
    }
  },
  "output": {"sensitivity": "summary"}
}
